{
  "$schema": "../schemas/circuit-registry.schema.json",
  "kind": "circuit-registry",
  "status": "mock",
  "note": "NON-AUTHORITATIVE development data. Physical facts are illustrative.",
  "circuits": [
    {
      "id": "spa-francorchamps",
      "name": "Circuit de Spa-Francorchamps",
      "locality": "Stavelot",
      "country": "Belgium",
      "countryCode": "BE",
      "latitude": 50.4372,
      "longitude": 5.9714,
      "lengthMeters": 7004,
      "cornerCount": 19,
      "direction": "clockwise",
      "firstGrandPrixYear": 1950,
      "lapRecord": { "driverId": "max-verstappen", "timeMillis": 106286, "year": 2020 }
    },
    {
      "id": "monza",
      "name": "Autodromo Nazionale Monza",
      "locality": "Monza",
      "country": "Italy",
      "countryCode": "IT",
      "latitude": 45.6156,
      "longitude": 9.2811,
      "lengthMeters": 5793,
      "cornerCount": 11,
      "direction": "clockwise",
      "firstGrandPrixYear": 1950,
      "lapRecord": null
    },
    {
      "id": "monaco",
      "name": "Circuit de Monaco",
      "locality": "Monte Carlo",
      "country": "Monaco",
      "countryCode": "MC",
      "latitude": 43.7347,
      "longitude": 7.4206,
      "lengthMeters": 3337,
      "cornerCount": 19,
      "direction": "clockwise",
      "firstGrandPrixYear": 1950,
      "lapRecord": null
    },
    {
      "id": "silverstone",
      "name": "Silverstone Circuit",
      "locality": "Silverstone",
      "country": "United Kingdom",
      "countryCode": "GB",
      "latitude": 52.0733,
      "longitude": -1.0142,
      "lengthMeters": 5891,
      "cornerCount": 18,
      "direction": "clockwise",
      "firstGrandPrixYear": 1950,
      "lapRecord": null
    },
    {
      "id": "albert-park",
      "name": "Albert Park Circuit",
      "locality": "Melbourne",
      "country": "Australia",
      "countryCode": "AU",
      "latitude": -37.8497,
      "longitude": 144.968,
      "lengthMeters": 5278,
      "cornerCount": 14,
      "direction": "clockwise",
      "firstGrandPrixYear": 1996,
      "lapRecord": null
    },
    {
      "id": "suzuka",
      "name": "Suzuka International Racing Course",
      "locality": "Suzuka",
      "country": "Japan",
      "countryCode": "JP",
      "latitude": 34.8431,
      "longitude": 136.541,
      "lengthMeters": 5807,
      "cornerCount": 18,
      "direction": "clockwise",
      "firstGrandPrixYear": 1987,
      "lapRecord": null
    },
    {
      "id": "shanghai",
      "name": "Shanghai International Circuit"
    },
    {
      "id": "miami",
      "name": "Miami International Autodrome"
    },
    {
      "id": "gilles-villeneuve",
      "name": "Circuit Gilles Villeneuve"
    },
    {
      "id": "barcelona-catalunya",
      "name": "Circuit de Barcelona-Catalunya"
    },
    {
      "id": "spielberg",
      "name": "Red Bull Ring"
    },
    {
      "id": "hungaroring",
      "name": "Hungaroring"
    },
    {
      "id": "zandvoort",
      "name": "Circuit Zandvoort"
    },
    {
      "id": "madrid",
      "name": "Madring"
    },
    {
      "id": "baku",
      "name": "Baku City Circuit"
    },
    {
      "id": "sepang",
      "name": "Sepang International Circuit"
    },
    {
      "id": "marina-bay",
      "name": "Marina Bay Street Circuit"
    },
    {
      "id": "circuit-of-the-americas",
      "name": "Circuit of the Americas"
    },
    {
      "id": "hermanos-rodriguez",
      "name": "Autódromo Hermanos Rodríguez"
    },
    {
      "id": "jose-carlos-pace",
      "name": "Autódromo José Carlos Pace"
    },
    {
      "id": "las-vegas-strip",
      "name": "Las Vegas Strip Circuit"
    },
    {
      "id": "lusail",
      "name": "Lusail International Circuit"
    },
    {
      "id": "yas-marina",
      "name": "Yas Marina Circuit"
    },
    {
      "id": "jeddah-corniche",
      "name": "Jeddah Corniche Circuit"
    }
  ]
}
